{
  "id": "bonewarden_hollow_bone_shiv",
  "abilities": [
    "bone_spear",
    "shiv"
  ],
  "anti": false,
  "effect": {
    "type": "bonus_damage",
    "value": 5,
    "appliesAfter": "second_ability"
  },
  "hint": "A shattered bone spear becomes a jagged shiv in the Hollow's skilled hands.",
  "fieldNotes": {
    "discoveredBy": null
  }
}