{
  "id": "bonewarden_cauterist_bone_link",
  "abilities": ["bone_link", "pyre"],
  "anti": false,
  "effect": {
    "type": "bonus_damage",
    "value": 4,
    "appliesAfter": "second_ability"
  },
  "hint": "Bone-link channels pyre damage to all linked allies.",
  "fieldNotes": {
    "discoveredBy": null
  }
}
