{
  "id": "stillblade_hollow_smoke_silence",
  "abilities": [
    "silence_strike",
    "smoke_bomb"
  ],
  "anti": false,
  "effect": {
    "type": "bonus_damage",
    "value": 5,
    "appliesAfter": "second_ability"
  },
  "hint": "Smoke and silence create a killing ground where magic dies unheard.",
  "fieldNotes": {
    "discoveredBy": null
  }
}