{
  "id": "bonewarden_cauterist_purifying_bones",
  "abilities": [
    "bone_spear",
    "purifying_flame"
  ],
  "anti": false,
  "effect": {
    "type": "bonus_damage",
    "value": 5,
    "appliesAfter": "second_ability"
  },
  "hint": "Cauterist flame purifies bone fragments mid-flight, creating searing bone-shards.",
  "fieldNotes": {
    "discoveredBy": null
  }
}