{
  "id": "hollow_marcher_smoke_skirmish",
  "abilities": [
    "smoke_bomb",
    "skirmish"
  ],
  "anti": false,
  "effect": {
    "type": "bonus_damage",
    "value": 5,
    "appliesAfter": "second_ability"
  },
  "hint": "Smoke cover turns a skirmish into a devastating ambush.",
  "fieldNotes": {
    "discoveredBy": null
  }
}