{
  "id": "bonewarden_fieldwright_bone_engine",
  "abilities": [
    "raise_minion",
    "deploy_sentry"
  ],
  "anti": false,
  "effect": {
    "type": "bonus_damage",
    "value": 5,
    "appliesAfter": "second_ability"
  },
  "hint": "Raised dead crew the Fieldwright's sentry, a grinding bone engine that never tires.",
  "fieldNotes": {
    "discoveredBy": null
  }
}
