{
  "id": "marcher_stillblade_void_arrow",
  "abilities": [
    "volley",
    "break_magic"
  ],
  "anti": false,
  "effect": {
    "type": "bonus_damage",
    "value": 6,
    "appliesAfter": "second_ability"
  },
  "hint": "Arrows loosed through a Stillblade's break-magic strip enemy wards away mid-flight.",
  "fieldNotes": {
    "discoveredBy": null
  }
}
