{
  "id": "cauterist_inkblood_ash_and_flame",
  "abilities": [
    "purifying_flame",
    "veil_of_ash"
  ],
  "anti": false,
  "effect": {
    "type": "bonus_damage",
    "value": 5,
    "appliesAfter": "second_ability"
  },
  "hint": "Requires ash from a burned Engine. Purifying flame ignites the veil into a blinding flash.",
  "fieldNotes": {
    "discoveredBy": null
  }
}