{
  "id": "bonewarden_marcher_hunting_party",
  "abilities": [
    "raise_minion",
    "tracking"
  ],
  "anti": false,
  "effect": {
    "type": "bonus_damage",
    "value": 5,
    "appliesAfter": "second_ability"
  },
  "hint": "Requires a bone sample from the target's territory. Bone constructs track with uncanny precision.",
  "fieldNotes": {
    "discoveredBy": null
  }
}